{
  "schema": "moat.grant.v1",
  "grant_id": "grant-01hz",
  "idempotency_key": "incident-42:allow-once",
  "scope": {
    "kind": "process_instance",
    "device_id": "arch-desk",
    "boot_id": "6f1c2a8e-boot",
    "process": {
      "pid": 4242,
      "start_generation": 918273
    },
    "executable": {
      "path": "/usr/bin/curl"
    }
  },
  "destination": {
    "kind": "address",
    "address": "2001:db8::7"
  },
  "transport": "tcp",
  "port": 443,
  "issued_at": "2026-10-27T15:00:00Z",
  "not_before": "2026-10-27T15:00:00Z",
  "admission_until": "2026-10-27T15:10:00Z",
  "stream_policy": "terminate_at_deadline",
  "base_policy_digest": "sha256:1111111111111111111111111111111111111111111111111111111111111111",
  "issuer": {
    "principal": "owner:robert",
    "role": "owner",
    "key_id": "a1b2c3d4e5f60718"
  },
  "approval_digest": "sha256:2222222222222222222222222222222222222222222222222222222222222222",
  "reason": "Allow once for incident 42"
}
