{
  "schema": "moat.grant.v1",
  "grant_id": "grant-01j0",
  "idempotency_key": "incident-42:allow-once",
  "scope": {
    "kind": "task",
    "device_id": "arch-desk",
    "boot_id": "6f1c2a8e-boot",
    "task_id": "20261027150000-a1b2c3d4e5f6"
  },
  "destination": {
    "kind": "address",
    "address": "198.51.100.7"
  },
  "transport": "udp",
  "port": 53,
  "issued_at": "2026-10-27T15:00:00Z",
  "not_before": "2026-10-27T15:00:00Z",
  "admission_until": "2026-10-28T15:00:00Z",
  "stream_policy": "admission_only",
  "base_policy_digest": "sha256:1111111111111111111111111111111111111111111111111111111111111111",
  "issuer": {
    "principal": "owner:robert",
    "role": "owner",
    "key_id": "a1b2c3d4e5f60718"
  },
  "approval_digest": "sha256:2222222222222222222222222222222222222222222222222222222222222222",
  "reason": "Allow once for incident 42"
}
